Reviewer,Rating,Review,Date
krash0809,,"For $10 this toothbrush is great! Multiple settings and is sleek looking! Really cool it comes with a carrying case and the charging cord of course. One downside- needs a base to be able to stand up when not in use.... but, again, for $10 not complaining!!!","Reviewed in the United States on December 25, 2024"
Jen,,Got this for my child. We like that it has multiple brushing settings. The charge holds very long and quickly recharges. Very good value. Nice compact travel case! I can't think of any cons to this item.,"Reviewed in the United States on December 31, 2024"
Johnny Davis,,"It comes with all the attachments ,the case, the charger, and anything else that you could possibly want. The only thing is when you put it in your mouth, holy hell. LOL. It feels like my toothbrush is trying to take off in the outer space when I will turn it on. My whole head wouldn't stop vibrating for 20 minutes but my teeth were clean.","Reviewed in the United States on October 21, 2024"
aoliveras80,,The product is everything that I expected .,"Reviewed in the United States on January 16, 2025"
Tia,,I love the toothbrush! 10/10 definitely recommend. Battery life is great haven’t had to recharge it yet I have had it over a month,"Reviewed in the United States on January 5, 2025"
Falicia,,Definitely doesn't keep charge for 60 days. It lasts for a few days and that's it. But it is a powerful toothbrush.,"Reviewed in the United States on November 16, 2024"
amanda lindsay,,Good set of toothbrushes. I will say it’s kind of painful with any of the settings on but other than that it’s great.,"Reviewed in the United States on December 29, 2024"
Tyler,,"It’s really cool to have the case to put the toothbrush in for travel. Unlike other electric travel toothbrushes I’ve bought before, this one remains full size. I would definitely buy this again.","Reviewed in the United States on December 29, 2024"
joyce,,Didn't like the cheap white plastic box but the toothbrush is amazing. It has three levels and my teeth felt so clean.,"Reviewed in the United States on January 6, 2025"
Donald day,,It come with 4 heads and has multiple setting and work great. I enjoy using it. Was super fast and great service.,"Reviewed in the United States on January 6, 2025"
Leslie Frey,,My daughter and I both love these! Your mouth feels so clean after using!,"Reviewed in the United States on January 13, 2025"
s,,I have sensory issues with electric toothbrushes normally but the “soft” setting here is gentle enough for me and doesn’t bother me. The only thing I’ll say is that the button is a tad bit sensitive and sometimes it’s easy to accidentally press it and the head isn’t the sturdiest. But it came with so many replacements and a case and the pink is cute.,"Reviewed in the United States on October 13, 2024"
Kindle Customer,,So surprised how well this worked especially for the price. The modes are pretty powerful.,"Reviewed in the United States on January 5, 2025"
Teresa Braziel,,Girls loved them,"Reviewed in the United States on January 14, 2025"
Linda,,"I love this toothbrush. It's so great at getting dentist clean teeth.

It has different settings and gives stops to let you know you're cleaning your teeth enough. The size is perfect for any size hand. I got the lilac color which is beautiful.

The battery is strong and the brush has bristles that are medium soft. I'm so happy I got this toothbrush.

I recommend this to anyone looking for a new toothbrush. It even comes with extra brush refills.","Reviewed in the United States on November 23, 2024"
Debra Rooney,,I like the slim shape and that it stays charged for quite a while. My only complaint is the sound. It is very shrill and sounds like a giant mosquito.,"Reviewed in the United States on November 5, 2024"
Gregory Y.,,Great product clean very good three setting but i ise only one nice.,"Reviewed in the United States on January 4, 2025"
PJ,,Works pretty well. My only issue is for some reaason this tends to drip down the grip so has to be wiped down after every use. But well worth the cost.,"Reviewed in the United States on November 4, 2024"
Abby,,Umm kinda good for price but I feels little cheap quality!! Anyway that's the only stuff with this price so I'm happy,"Reviewed in the United States on November 22, 2024"
Ruth A Kirchner,,"I keep this electric toothbrush set in my ready-to-travel cosmetics bag so I never have to worry about forgetting to pack my toothbrush. (it has happened on more than one occasion). Granted, not quite as powerful as my Philips Sonicare but this does the trick.","Reviewed in the United States on December 14, 2024"
